,"Is it normal to cry during therapy? I start counseling/therapy in a few days (I'm freaking out) but my main fear is that I'll cry and embarrass myself, is it something to worry about?","How do I cope with separation anxiety while boyfriend is out of town? I have been with my boyfriend for more than a year. He recently got a new job and travels a lot. I’m not used to him being gone all the time. I feel as though he has forgotten about me because he does not talk with me as much and doesn’t keep me up to date on everything that he does throughout the day, which he used to. I feel lost, sad and unwanted. This is really a tough new challenge. I just want to break up with him, but I love him so much. I don’t know why he is acting this way lately. I believe I have separation anxiety. Is there anything that I can do to help me cope with this while he is out of town?",Is it normal to go into therapy feeling nervous? I've gone to a couple therapy sessions so far and still everytime I walk in I get nervous and shaky. Is this normal? Should I still be feeling like this?,How is it that I fear going to sleep? I just about fall asleep then I can't help but sit up and walk around.,"Can I change my feeling of being worthless to everyone? I'm going through some things with my feelings and myself. I barely sleep and I do nothing but think about how I'm worthless and how I shouldn't be here. I've never tried or contemplated suicide. I've always wanted to fix my issues, but I never get around to it. How can I change my feeling of being worthless to everyone?","Do I have too many issues for counseling? I have so many issues to address. I have a history of sexual abuse, I’m a breast cancer survivor and I am a lifetime insomniac. I have a long history of depression and I’m beginning to have anxiety. I have low self esteem but I’ve been happily married for almost 35 years. I’ve never had counseling about any of this. Do I have too many issues to address in counseling?",How can I best fight the winter blues? Every winter I find myself getting sad because of the weather. How can I fight this?,"How can I stop treating people badly? I feel like I'm so alone. I treat people horribly based on what's going on in my life and don't realize it. It ends up pushing them away, especially the ones I love the most. I have a weird feeling deep down inside, and it won't go away. I feel like I'm collapsing.","I lost my mom, and I feel like I'm depressed Last year, I just always felt hopeless. I don't have a great relationship with my sister. I lost my mother recently, and that really added to my sadness. My sister always brings up how I was never close to my mother.",How do I stop grieving my mother’s death? What can I do to stop grieving my mother’s death? When I am awake I just cry every day. I don't have anyone to talk to. I need help; I am still cry over her. Will I ever stop crying? It’s been 3 years.,How do I find happiness after my boyfriend passed away? I loved him more than anything. He passed away on our anniversary which was also the day I was going to apply for our apartment. I'm not handling it well. I moved to a new town and started a new life but nothing helps.,How can I ask my boyfriend about who he's texting? We've been in a long distance relationship for two and a half years. I recently saw his phone and saw the people he texts the most and one of them was a female coworker. I don't know how to approach this situation. How do I ask him about it?.,"My girlfriend is always accusing me of cheating on her when I haven't Over a year ago I had a female friend. She turned out to be kind of crazy so I decided to stop talking to her. When she would call me I wouldn't answer the phone. This made my girlfriend really suspicious. She would ask me why I wouldn't ever answer that phone number. I told my girlfriend that I don't want to be friends with that other woman, but I don't think she believes me. How can I get my girlfriend to understand?","My fiancé cheated. How can we mend our relationship? I'm in a relationship with my fiancé and I currently found out that she's been cheating on me with a co-worker. I was very upset none the less. I understand what she did was wrong, but I want to spend the rest of my life with her. So I'm willing to forgive and move on. We have been together for a little over 9 years, and we have a son. At the beginning of our relationship, I was unfaithful and she caught me cheating. She forgave me for what I've done to her and since then I been completely faithful. I'm worried about our relationship and want to move forward but its been very unsettling. All I can think about is her with another man. I don't know what to do or where to go for advice?","I'm with someone, but I have unresolved feelings for my ex-boyfriend Every once and a while, I think about my ex-boyfriend from four years ago, and my current friend. It’s like I can't get past it, and I need some kind of closure. I keep thinking about how we had something, but it got cut off due to parental intervention. Nothing was ever wrong with it. Now we've become friends, but there's this huge sexual tension between us, or at least I feel it when we're physically in the same place. Two summers ago, we saw each other casually for a while, but we never had sex then or while we were dating, which was only for two months three years ago. I'm now in my 20s, and my current boyfriend is amazing and in his 30s. Despite the age difference, I know we're a really good match. We've never really fought and are able to make compromises and talk everything out. I tell him everything. Also, my ex-boyfriend has a girlfriend now as well. He’s been seeing her on and off for the past two and a half years, besides when they broke up and we had our casual thing. That summer, I told him I didn't want anything serious and broke it off. Only a week later, he had gotten back together with his girlfriend. His girlfriend is kind of mean spirited. I'm sure she may be different around him, but I worry about him committing to her in the long run. They're supposed to move in together soon. But still, I feel this connection with my ex-boyfriend, and I feel like he does too. I don't know what to do. I need some closure or I'm not going to be able to move on from this. I don't know what it is, but it's driving me crazy. I’m so happy with my current boyfriend, and I know he will do everything in his power to make my life beautiful and fulfilling. He’s such a good person. I also know my ex-boyfriend smokes marijuana and does other things, but I can't get it out of my head. I'm trying to take a nap right now between classes, but I can't sleep because my mind is racing. I've never been so hung up on something for this long ever. I want to just talk it out with my ex-boyfriend, but I don't know if that's a good idea because of the possibility that it could blow up in my face. If he told his girlfriend, everything could go wrong because she hates me. If my current boyfriend knew, he would be crushed. On one hand, I want my ex-boyfriend to say no to having feelings for me, but I would be terrified of what to do if he said he has feelings too. Where would I go from there? On the other hand, I feel like I can't move forward in my relationship with my current boyfriend without closure from this. Sometimes I wish I could just cut off everything that had to do with my ex, but I don't want to. Please help me, because I really have no idea what to do.","How can my boyfriend forgive me when I can't forgive myself? I have been in a relationship with my boyfriend for about six years now. In the past, our relationship was difficult and frustrating. We argued a lot, and due to that, there was a lot of tension between us. We stayed together because we love each other and wanted to make it work. I used to party a lot, and several times I got into situations where I would end up kissing someone else. These situations were never more than just kissing. I have come clean about these situations with my boyfriend, and he decided to forgive and move forward with me. I love him so much and want to work things out too, but I'm having a difficult time understanding how he can forgive me. I can't seem to forgive myself. I'm overwhelmed with feelings of guilt and unworthiness.","I weigh over 220 pounds and I am 16 years old About 3 years ago or so I was skinny, but I was still ugly. I really do want to change that but I've tried 3 times. Now can I try but don't stop. At school I get bullied about my weight and my ugliness and I have been bullied my whole life that I believe them. How can I stop thinking about them and don't let it get in my head? My parents said I don't weight that much but, they do think I am fat but, they tell me I am not. I told my parents that I need to go to a therapist, but they think I am fine and I think they don't want to deal with it.","How do I cope with ""never being good enough?"" I'm always told I'm not good enough or trying hard enough. I put 100% in to every thing. I'm worn out, I've worked on all of my family relationships, I'm doing great in school, I'm kind to those in need and otherwise. I stick to my religious beliefs and leave room for mistakes and learn from others so I don't have to make as many and the ones I do I learn from. Somehow it's still not good enough and nothing I do works. Nothing has changed, and I feel hopeless. Any suggestions or ideas?","I'm addicted to smoking. How can I stop? I'm planning to have baby, so I have to quit smoking - but it's hard. Sometimes it's not a physical need, it's mental. I cannot help myself from thinking about smoking. What can I do to get rid of this addiction?","What can I do to help my dad stop drinking? Or how to send him somewhere that can help him, something like The Baker Act.",Can I sign my brother into a mental health facility? My brother has been diagnosed with paranoid schizophrenia and has not been taking his medication. He's been using methamphetamine and alcohol and was found sleeping naked in my step mom driveway in 12 degree weather. I was adopted in by his dad (who just passed) and his mother will not Get involved because she's afraid of financial responsibility. Do I have the rights to be able to sign my brother into mentalhealth facility?,"Is it possible for a person to stop feeling emotions? I was raped a couple months ago, Since then, along with other unfortunately events that have occurred, I have been having trouble feeling emotions. It's almost as if I'm a sociopath lacking any feeling. What can I do to change this?","How can I avoid having past traumatic experiences affect my present and future? I have family issues, and my dad was both violent and a cheater.",My past is holding me back from my future. How can I get my life back? There are issues from my past that have me very heavily burdened in my heart. I've been torn for so many years and I need help so I can move on with my life. I experienced trauma when I was 8 years old and I did come out about it until I was 40. Now I know this is what's holding me back on my happiness. I've met a very loving and caring man but because I'm holding on to these things from my past I’m pushing him away. How can I get my life back?
0,"['9 Ways Crying May Benefit Your HealthDetoxifies the body. Reflex tears clear debris, like smoke and dust, from your eyes. ...Helps self-soothe. Crying may be one of your best mechanisms to self-soothe. ...Dulls pain. ...Improves mood. ...Rallies support. ...Helps you recover from grief. ...Restores emotional balance. ...Helps baby breathe. ...Helps baby sleep. ...'
 'Please feel free to cry during therapy if you suddenly feel painful emotions arising when you describe some of your unsatisfying and unfulfilling relationships and situations.Crying when realizing the emotional hurt and unfairness between you and someone, clears you for new ways of handling interactions.As a therapist, I always have a box of tissues on the table next to the couch where people who utilize my therapy, sit.I hope you will soon discover that once your tears unlock your awareness of harmful relationships in your life, you will quickly see the freedom to establish new and happier patterns of relating.Have a good therapy!'
 'It’s completely normal to cry during therapy—many people do! Therapy is a safe space designed for you to explore your feelings, even the ones you might usually hold back. Crying is often a natural and healthy response to processing difficult emotions, and therapists are very used to it. In fact, it’s often seen as a sign of progress because it shows you’re allowing yourself to be vulnerable and honest about how you feel.\r\n\r\nThe idea of crying in front of someone, especially someone you don’t know well yet, can feel intimidating or embarrassing, but keep in mind that your therapist’s job is to provide a non-judgmental and supportive environment. They’ve likely seen countless people cry and won’t think less of you for it. Instead, they’ll probably see it as a moment of connection and an opportunity to better understand and help you.\r\n\r\nIf you’re feeling nervous about it, you can even bring up this fear during your session. Sharing your worries about crying or feeling vulnerable can be a helpful starting point for the conversation. Therapists are there to help you feel comfortable and supported, so they’ll meet you where you are.\r\n\r\nRemember, therapy is your space, and it’s okay to feel however you feel in that moment—tears included. You’re not alone in this, and there’s nothing to be ashamed of. It’s a brave step to start therapy, and you’re already doing something amazing for yourself.'
 'It is not uncommon to be a bit nervous meeting your therapist (or another person) for the first time. Your therapist understands that calling and getting an appointment was a big step for you and will do their best to put you at ease. Providing a safe environment for our clients includes not judging them and being comfortable with the information and emotions that they share with us. It is ok to cry and to trust that the therapist will honor this as part of your process.'
 ""Crying is a natural process when you talk about upsetting things especially in therapy when you are opening up and being so vulnerable. I suggest that you consider how you would feel/respond to someone that was confiding to you and they began to cry. If you felt concerned, supportive and empathetic then you know exactly how us therapists feel when our clients are emotional in sessions. I suggest that you think of times where you have cried and how you felt at that time in public and what would have helped to make you feel less uncomfortable during your tears.\xa0I think of crying like any other natural reaction of our body such as sneezing, laughing, coughing. You can't help but do those things and most people won't really judge negatively if you do it in public. Similarly, crying is our body's reaction when we are emotional whether it is tears of joy, from a hilarious joke or from being upset.\xa0If you are very uncomfortable about crying but willing to start therapy perhaps you can ask the therapist if you can turn your chair around if you begin crying. This way you are not facing them and can self soothe without worrying about how you physically look at that time.I wish you luck and you should be proud of yourself for starting therapy and I wish you a wonderful journey on this important path that you are embarking on.""
 ""Many people cry during their therapy sessions. Actually most people cry in their therapist's office. I tell my clients that it's safe to cry in my office and crying isn't a sign of weakness. It's a normal human response to pain. People actually do more harm to themselves by trying not to cry than by crying. Crying is very cleansing and an important part of the healing process for many people.""
 'When talking about difficult issues, it is very normal to cry. Crying is a natural way for us to cope with the sadness that we experience in life. When confronting some of these things in a counseling session, tears just seem to come naturally. Every Counselor should be well equipped to handle that level of emotion, and you would be far from the first to cry when talking with a Counselor.'
 'It\'s completely normal to cry during therapy — in fact, it\'s one of the most common things that happens there. Therapists expect it, and more importantly, they\'re trained to handle it with care and without judgment. You won\'t embarrass yourself.\r\nHere\'s the thing: therapy is literally designed to be a safe space where you can express difficult emotions. Your therapist has seen countless people cry, and they see it as part of the healing process, not something awkward or shameful. They\'re not going to think less of you for it — if anything, showing emotion often means you\'re doing the real work of therapy.\r\nSome practical reassurance:\r\n\r\nTherapists keep tissues nearby for a reason — they\'re prepared for this\r\nYou don\'t have to apologize if you do cry (though many people reflexively do)\r\nIt\'s okay to take a moment to collect yourself; there\'s no rush\r\nNot everyone cries in therapy, and that\'s fine too — there\'s no \\""right\\"" way to do it\r\n\r\nThe fact that you\'re nervous means you care about doing this right, which is actually a good sign. But try to remember: therapy is for you. It\'s one of the few places where you can be completely honest about how you feel without worrying about how you come across.\r\nGood luck with your first session. The anticipation is often harder than the actual appointment.'
 ""It's totally normal to cry during therapy.  In fact, it's encouraged!  It's a place to explore deeper feelings.  You might feel silly at first, and that's normal too.  But the more you show up in counseling, the more comfortable you'll feel.  You're there to be true to yourself, and that's brave.  A good therapist won't shame you for crying.  You got this!""
 ""It is is absolutely normal to cry in therapy. I can understand wanting to keep everything together and put your best foot forward with everyone you come into contact with, but it can be such a powerful experience to cry with somebody that can hear you and accept you. It's so brave of you to go and share yourself with your counselor! I hope you will keep being brave as you begin healing.""
 ""Oh, crying in therapy is very normal! I have a stack of kleenex boxes in my office. Cry away, therapist are very used to it:) First time being in therapy is scary, but you'll soon know if you are a good match.""
 'First off, take a deep breath. What you’re feeling is incredibly common, but I can tell you with total confidence: **crying in therapy is not just ""normal""—it is practically the industry standard.**\r\n\r\nIt is the one place on earth where ""leaking from the eyes"" is considered a sign that the work is actually happening. Here is why you can stop worrying about it.\r\n\r\n---\r\n\r\n### 1. It’s a ""Green Flag"" for Therapists\r\nTherapists don\'t see tears as a sign of weakness or embarrassment; they see them as a sign of **safety and progress**. \r\n* **The Breakthrough:** Often, the moment a client starts to cry is the moment they’ve finally stopped ""performing"" or being ""fine.""\r\n* **The Release:** Therapy is about processing emotions. Crying is your body’s physical way of doing exactly that.\r\n\r\n### 2. They Are Prepared for It\r\nIf you walk into a bakery, you expect to see flour. If you walk into a therapy office, the therapist expects to see tears.\r\n* **The Tissue Box:** There is a reason a box of tissues is the cliché centerpiece of every therapist\'s office. They go through those boxes like water.\r\n* **Professionalism:** They have seen every version of crying—the silent single tear, the shaky voice, and the full-on ""ugly cry."" They won\'t be shocked, and they certainly won\'t judge you.\r\n\r\n### 3. You Can’t ""Fail"" Therapy\r\nYou might be worried that crying makes you look ""unstable"" or ""dramatic,"" but therapy is the one space where you are explicitly paid to be human.\r\n* **Control:** If you start to feel overwhelmed, you can even tell your therapist: *""I\'m feeling really emotional and I\'m afraid I\'m going to cry.""* * **Pacing:** A good therapist will help you pace yourself if things feel too intense too fast.\r\n\r\n---\r\n\r\n### Pro-Tips for Your First Session\r\nSince you’re ""freaking out"" a bit, here are a few things to keep in mind to lower the stakes:\r\n\r\n* **The First Session is an Interview:** You don\'t have to dive into your deepest trauma in the first 10 minutes. The first session is mostly about ""housekeeping"" (history, goals, and seeing if you vibe with the therapist).\r\n* **The ""After-Care"":** If you do cry, you might feel a bit drained afterward (a ""vulnerability hangover""). Try not to schedule anything high-stress immediately after your appointment.\r\n* **Water is Key:** Bring a bottle of water. Taking a sip is a great way to pause and ground yourself if you feel like you\'re losing your composure.\r\n\r\n> **Bottom line:** You are going to therapy to take care of yourself. If you cry, it just means you\'re doing the work. You’ve got this.\r\n\r\nWhat is the main thing you\'re hoping to get out of these sessions, once the initial nerves settle down?'
 'First off, I want to commend you for taking that tough, but important step in starting therapy. That’s a brave commitment to make to yourself.\xa0Yes, crying in therapy is not only normal, it’s encouraged!\xa0Crying is the body’s natural response to sadness, grief, happiness (think tears of joy!), stress and even anger, for some people. Therapy is a safe place to feel and express the full range of emotions, whether those are pleasant, unpleasant or anything in between.\xa0When you cry in therapy, you allow your mind and body to release stuck emotions that haven’t had the opportunity to come out yet. Do you ever notice that after you cry you feel a sense of relief? Like a giant weight was lifted off your shoulders? That’s a sign of healing and you can learn to embrace that. Even science has shown that certain hormones, like cortisol, are released in tears.\xa0If you’re worried about your therapist judging you for crying in session, let’s put that fear to rest. As therapists, we see people cry every day. Some clients cry immediately as they start their first session. Some clients don’t cry until a year or more into therapy. Everyone’s different. But trust me, we’ve seen it all and we won’t blink an eye or think a single negative thing about it.\xa0If anything, your therapist will probably see your pain and want to do everything in their power to help you work through it.'
 ""Hi there ! \xa0As someone who has practiced as a clinical psychologist for 25 years , I would say that crying is NOTHING TO WORRY ABOUT AT ALL ! Almost every single person I have worked with has cried at one point or another. \xa0Starting therapy takes a lot of courage; when you work with a therapist ,once you feel safe , \xa0you talk about a lot of very private and potentially emotional things that you may have never discussed with anyone before. \xa0I have seen \xa0people cry with sadness , cry with relief at releasing painful things they have held onto for a long time, cry because they feel so relieved that they finally feel heard. \xa0 I myself have sometimes cried with clients because some things they talk about are so profoundly moving. \xa0\xa0I can assure you that most , if not all , therapists expect clients to cry \xa0and there is nothing to be embarrassed about. \xa0 Crying can be very cathartic and can allow us to release a lot of painful feelings we have been stuffing down. \xa0 Crying is \xa0often a sign that you are really working things through and getting in touch with feelings that you need to get in touch with in order to heal .So , to summarize , don't worry at all about crying! It will probably feel uncomfortable \xa0at first , but I promise you , you will not be judged for crying in therapy. \xa0 And it will be less embarrassing once it happens a time or two and you are assured that your therapist will be there for you and won't judge you !Good luck !!""
 'Lots of people do cry in session, but your therapist won\'t be uneasy with this. \xa0Crying is a natural response and it also releases toxins, so some might say it\'s necessary! \xa0Remember that you can be in charge of what you talk about in your session and if there\'s something that feels too uncomfortable, just say, ""I\'m not ready to talk about that."" \xa0Your counselor wants \xa0you to feel at ease and will probably not push you right away to a very uncomfortable place. \xa0As you get to know your therapist, you will feel more relaxed and even not worry so much about how you appear to them. \xa0It\'s normal to be anxious going into a new situation especially when you might not feel in control of uncomfortable emotions. \xa0Don\'t give up, go and put your best effort in!\xa0Hope that helps,\xa0Allison'
 ""Please do not worry about crying. People cry, laugh, rage, rant, and talk during counseling sessions. Part of the therapy process is to look at your feelings, and to feel what you are actually feeling (instead of what you think you should feel). So if you need to cry, that's ok. If you feel embarrassed because you cried, or if you feel anxious that you might cry, well those feelings are ok as well. Your counselor can help you manage your feelings so that you can attain your goals, and your counseling session is the perfect place for that.""
